{
  "fixture_schema_version": 1,
  "id": "input.non_canonical_integer",
  "title": "An out-of-range integer is not canonical JSON",
  "description": "A JSON integer outside the Matrix canonical JSON safe integer range fails canonical conversion.",
  "status": "active",
  "minimum_stage": "contract",
  "matrix": {
    "spec_version": "1.19",
    "room_version": "12",
    "references": [
      "https://spec.matrix.org/v1.19/appendices/#canonical-json"
    ]
  },
  "provenance": {
    "kind": "authored",
    "source": "CyborgHeart pre-Codex seed",
    "license": "MIT OR Apache-2.0"
  },
  "input": {
    "mode": "raw-json",
    "raw_json": "{\"auth_events\":[],\"content\":{\"room_version\":\"12\"},\"depth\":0,\"hashes\":{\"sha256\":\"AAAAAAAAAAAAAAAAAAAAAAAAAAAAAAAAAAAAAAAAAAA\"},\"origin_server_ts\":9007199254740992,\"prev_events\":[],\"sender\":\"@alice:example.org\",\"signatures\":{\"example.org\":{\"ed25519:1\":\"AAAAAAAAAAAAAAAAAAAAAAAAAAAAAAAAAAAAAAAAAAAAAAAAAAAAAAAAAAAAAAAAAAAAAAAAAAAAAAAAAAAAAA\"}},\"state_key\":\"\",\"type\":\"m.room.create\"}",
    "room_version": "12",
    "provenance": "federated",
    "key_validity_reference_ts": 1,
    "options": {
      "evidence_level": "standard"
    }
  },
  "facts": {
    "events": [],
    "state_after": [],
    "current_room_state": null,
    "signing_keys": [],
    "policy_recommendations": []
  },
  "budget": {
    "canonical_json_bytes": 65535,
    "events_inspected": 64,
    "state_entries_inspected": 256,
    "auth_events_inspected": 64,
    "auth_chain_edges": 512,
    "graph_edges": 512,
    "signature_verifications": 16,
    "state_resolution_steps": 1024
  },
  "expect": {
    "kind": "input-error",
    "code": "input.non_canonical_value",
    "stage": "canonical_input",
    "details": {
      "category": "integer_range"
    },
    "dependencies": [],
    "consequences": [],
    "work": {
      "max": {
        "canonical_json_bytes": 65535,
        "events_inspected": 1,
        "state_entries_inspected": 0,
        "auth_events_inspected": 0,
        "auth_chain_edges": 0,
        "graph_edges": 0,
        "signature_verifications": 0,
        "state_resolution_steps": 0
      }
    }
  }
}
