{
  "fixture_schema_version": 1,
  "id": "signing.missing_required_signature",
  "title": "A missing required event signature is a drop",
  "description": "The sender server is a required signer but the candidate contains no signature from that entity.",
  "status": "active",
  "minimum_stage": "verified-intake",
  "matrix": {
    "spec_version": "1.19",
    "room_version": "12",
    "references": [
      "https://spec.matrix.org/v1.19/server-server-api/#validating-hashes-and-signatures-on-received-events"
    ]
  },
  "provenance": {
    "kind": "authored",
    "source": "CyborgHeart pre-Codex seed",
    "license": "MIT OR Apache-2.0"
  },
  "input": {
    "mode": "canonical-object",
    "candidate": {
      "auth_events": [],
      "content": {
        "room_version": "12"
      },
      "depth": 0,
      "hashes": {
        "sha256": "AAAAAAAAAAAAAAAAAAAAAAAAAAAAAAAAAAAAAAAAAAA"
      },
      "origin_server_ts": 1,
      "prev_events": [],
      "sender": "@alice:example.org",
      "signatures": {},
      "state_key": "",
      "type": "m.room.create"
    },
    "asserted_event_id": null,
    "room_version": "12",
    "provenance": "federated",
    "key_validity_reference_ts": 1,
    "options": {
      "evidence_level": "standard"
    }
  },
  "facts": {
    "events": [],
    "state_after": [],
    "current_room_state": null,
    "signing_keys": [],
    "policy_recommendations": []
  },
  "budget": {
    "canonical_json_bytes": 65535,
    "events_inspected": 64,
    "state_entries_inspected": 256,
    "auth_events_inspected": 64,
    "auth_chain_edges": 512,
    "graph_edges": 512,
    "signature_verifications": 16,
    "state_resolution_steps": 1024
  },
  "expect": {
    "kind": "complete",
    "code": "drop.missing_required_signature",
    "stage": "signer_discovery",
    "details": {
      "server": "example.org"
    },
    "dependencies": [],
    "consequences": [],
    "work": {
      "max": {
        "canonical_json_bytes": 65535,
        "events_inspected": 1,
        "state_entries_inspected": 0,
        "auth_events_inspected": 0,
        "auth_chain_edges": 0,
        "graph_edges": 0,
        "signature_verifications": 0,
        "state_resolution_steps": 0
      }
    },
    "disposition": "dropped"
  }
}
