{
  "fixture_schema_version": 1,
  "id": "input.not_an_object",
  "title": "A non-object root is not a candidate event",
  "description": "A valid JSON array cannot enter the event engine because a Matrix candidate PDU is an object.",
  "status": "active",
  "minimum_stage": "contract",
  "matrix": {
    "spec_version": "1.19",
    "room_version": "12",
    "references": [
      "https://spec.matrix.org/v1.19/appendices/#canonical-json"
    ]
  },
  "provenance": {
    "kind": "authored",
    "source": "CyborgHeart pre-Codex seed",
    "license": "MIT OR Apache-2.0"
  },
  "input": {
    "mode": "raw-json",
    "raw_json": "[]",
    "room_version": "12",
    "provenance": "federated",
    "key_validity_reference_ts": 1,
    "options": {
      "evidence_level": "standard"
    }
  },
  "facts": {
    "events": [],
    "state_after": [],
    "current_room_state": null,
    "signing_keys": [],
    "policy_recommendations": []
  },
  "budget": {
    "canonical_json_bytes": 65535,
    "events_inspected": 64,
    "state_entries_inspected": 256,
    "auth_events_inspected": 64,
    "auth_chain_edges": 512,
    "graph_edges": 512,
    "signature_verifications": 16,
    "state_resolution_steps": 1024
  },
  "expect": {
    "kind": "input-error",
    "code": "input.not_an_object",
    "stage": "canonical_input",
    "details": {
      "root_type": "array"
    },
    "dependencies": [],
    "consequences": [],
    "work": {
      "max": {
        "canonical_json_bytes": 65535,
        "events_inspected": 1,
        "state_entries_inspected": 0,
        "auth_events_inspected": 0,
        "auth_chain_edges": 0,
        "graph_edges": 0,
        "signature_verifications": 0,
        "state_resolution_steps": 0
      }
    }
  }
}
