{
  "fixture_schema_version": 1,
  "id": "room_v12.missing_content",
  "title": "Missing content fails structural PDU preflight",
  "description": "The released Ruma format helper does not cover every required field, so CyborgHeart preflight rejects a candidate without content.",
  "status": "active",
  "minimum_stage": "verified-intake",
  "matrix": {
    "spec_version": "1.19",
    "room_version": "12",
    "references": [
      "https://spec.matrix.org/v1.19/rooms/v12/#event-format",
      "https://spec.matrix.org/v1.19/server-server-api/#checks-performed-on-receipt-of-a-pdu"
    ]
  },
  "provenance": {
    "kind": "authored",
    "source": "CyborgHeart pre-Codex seed",
    "license": "MIT OR Apache-2.0"
  },
  "input": {
    "mode": "canonical-object",
    "candidate": {
      "auth_events": [],
      "depth": 0,
      "hashes": {
        "sha256": "AAAAAAAAAAAAAAAAAAAAAAAAAAAAAAAAAAAAAAAAAAA"
      },
      "origin_server_ts": 1,
      "prev_events": [],
      "sender": "@alice:example.org",
      "signatures": {
        "example.org": {
          "ed25519:1": "AAAAAAAAAAAAAAAAAAAAAAAAAAAAAAAAAAAAAAAAAAAAAAAAAAAAAAAAAAAAAAAAAAAAAAAAAAAAAAAAAAAAAA"
        }
      },
      "state_key": "",
      "type": "m.room.create"
    },
    "asserted_event_id": null,
    "room_version": "12",
    "provenance": "federated",
    "key_validity_reference_ts": 1,
    "options": {
      "evidence_level": "standard"
    }
  },
  "facts": {
    "events": [],
    "state_after": [],
    "current_room_state": null,
    "signing_keys": [],
    "policy_recommendations": []
  },
  "budget": {
    "canonical_json_bytes": 65535,
    "events_inspected": 64,
    "state_entries_inspected": 256,
    "auth_events_inspected": 64,
    "auth_chain_edges": 512,
    "graph_edges": 512,
    "signature_verifications": 16,
    "state_resolution_steps": 1024
  },
  "expect": {
    "kind": "complete",
    "code": "drop.invalid_pdu_format",
    "stage": "pdu_format",
    "details": {
      "field": "content",
      "reason": "missing"
    },
    "dependencies": [],
    "consequences": [],
    "work": {
      "max": {
        "canonical_json_bytes": 65535,
        "events_inspected": 1,
        "state_entries_inspected": 0,
        "auth_events_inspected": 0,
        "auth_chain_edges": 0,
        "graph_edges": 0,
        "signature_verifications": 0,
        "state_resolution_steps": 0
      }
    },
    "disposition": "dropped"
  }
}
